{
  "standard": "odxp/0.1",
  "name": "convai-innovations/laya:main",
  "profile": "encoder-markers",
  "weights": {
    "path": "model.onnx",
    "sha256": "1142759d130031109301c985599303487e20ecbbca2d1e1f631b2a31fc4d4259",
    "format": "onnx",
    "opset": 18,
    "data": [
      {
        "path": "model.safetensors",
        "sha256": "891102d372688fc2a094dac56a384bc537b87c63f21f9f3dac0be2b7cbc8d86c"
      }
    ]
  },
  "tokenizer": {
    "path": "tokenizer.json",
    "sha256": "6c8aaa9a542084f2457eab775d4eeb51f92a70c0fd9de28d5edb0ddec3c08d30"
  },
  "template": {
    "path": "template.json",
    "sha256": "8cc158f210e97ec71b7bba84436b5e0ab1a7ae5304774c70908c48ac62192d9d"
  },
  "calibration": {
    "path": "calibration.json",
    "sha256": "c8e95672ad9728db256c11d3d0d28ec439a9b1e3339cca8dd1303085e61fc7f3"
  },
  "answers": {
    "confidence": {
      "choice": "entropy",
      "score": "entropy",
      "noul": "max-probability"
    }
  },
  "limits": {
    "max_tokens": 512,
    "max_options": 20,
    "max_levels": 10,
    "max_option_tokens": 48
  },
  "source": {
    "model": "convaiinnovations/laya",
    "license": "Apache-2.0",
    "encoder": "answerdotai/ModernBERT-large",
    "checkpoint": "laya",
    "export": {
      "graph": {
        "opset": 18,
        "initializers_from_checkpoint": 201,
        "cast_from_half_precision": 201,
        "nodes": 2131,
        "graph_bytes": 5139263
      },
      "verification": {
        "rows": 5,
        "same_argmax": 5,
        "max_abs_logit": 1.1920928955078125e-05,
        "max_abs_p": 1.153931795616625e-06
      }
    },
    "converted_by": "opendxp 0.1.0",
    "converted_at": "2026-09-28T15:50:11Z"
  },
  "conformance": {
    "path": "conformance.jsonl",
    "sha256": "e5c3a522d6c16c9e27a5034780ba6543195772a062f31ee77c898cc502a6bf8c",
    "cases": 52,
    "questions": 91,
    "errors": 0,
    "tolerance": {
      "max_abs_dp": 0.01,
      "tie_margin": 0.001
    },
    "generated_by": {
      "runtime": "laya",
      "code": "laya.load(...).system_one",
      "laya": "0.3.5",
      "torch": "2.14.0",
      "transformers": "5.17.0",
      "device": "cpu",
      "tool": "opendxp 0.1.0",
      "seconds": 8.8
    }
  }
}
